{
  "timestamp": "2025-08-30 21:59:27 JST",
  "config": {
    "min_ratio": 50.0,
    "max_p95_us": 50.0,
    "warmup": 100,
    "n": 1000
  },
  "benchmarks": {
    "pattern_expansion": {
      "fast": {
        "ops": 5734.635494045614,
        "p50_us": 165.29997810721397,
        "p95_us": 196.49998284876347,
        "p99_us": 294.9000336229801,
        "min_us": 154.69989739358425,
        "max_us": 423.8998517394066,
        "mean_us": 174.04100624844432,
        "std_us": 32.402121547566566
      },
      "slow": {
        "ops": 6583.191715973411,
        "p50_us": 135.00009663403034,
        "p95_us": 171.19990661740303,
        "p99_us": 382.099999114871,
        "min_us": 129.5998226851225,
        "max_us": 1018.1998368352652,
        "mean_us": 151.5949983149767,
        "std_us": 94.35974123279875
      },
      "ratio": 0.8711026112350844
    },
    "config_compilation": {
      "fast": {
        "ops": 28.771604956603465,
        "p50_us": 33113.49987052381,
        "p95_us": 45316.50012359023,
        "p99_us": 51240.19994400442,
        "min_us": 27718.09999831021,
        "max_us": 59958.30008760095,
        "mean_us": 34755.56797813624,
        "std_us": 6187.696093091761
      },
      "slow": {
        "ops": 36713.41483346087,
        "p50_us": 21.300045773386955,
        "p95_us": 67.49993190169334,
        "p99_us": 78.59990000724792,
        "min_us": 16.50000922381878,
        "max_us": 226.09997540712357,
        "mean_us": 26.983991265296936,
        "std_us": 31.5590965912784
      },
      "ratio": 0.0007836809811105018
    },
    "kernel_cache": {
      "fast": {
        "ops": 10340.99428514263,
        "p50_us": 86.50007657706738,
        "p95_us": 137.1998805552721,
        "p99_us": 266.1999315023422,
        "min_us": 83.09981785714626,
        "max_us": 393.50008592009544,
        "mean_us": 96.37350216507912,
        "std_us": 34.76893518817248
      },
      "slow": {
        "ops": 117350.22796035964,
        "p50_us": 7.90017656981945,
        "p95_us": 8.899951353669167,
        "p99_us": 11.400086805224419,
        "min_us": 7.400056347250938,
        "max_us": 31.100120395421982,
        "mean_us": 8.322999347001314,
        "std_us": 2.267445333813678
      },
      "ratio": 0.08812078565911069
    }
  },
  "overall": {
    "min_ratio": 0.0007836809811105018,
    "max_p95_us": 45316.50012359023,
    "ratio_ok": false,
    "fast_p95_ok": false
  },
  "passed": false
}